{
  "schema_version": "1.0",
  "incident_id": "incident-malicious-ui",
  "status": "MITIGATED",
  "severity": "ERROR",
  "confidence": "HIGH",
  "timeline": [
    {
      "timestamp_utc": "2026-08-08T00:00:00Z",
      "kind": "DETECTED",
      "actor": "sensor",
      "reference": "evidence-before-1"
    },
    {
      "timestamp_utc": "2026-08-08T00:01:00Z",
      "kind": "VERIFIED",
      "actor": "worker",
      "reference": "evidence-after-1"
    }
  ],
  "evidence": [
    {
      "evidence_id": "evidence-before-1",
      "kind": "ui.snapshot",
      "summary": "<script>alert(\"unsafe\")</script> [run](javascript:alert(1))"
    },
    {
      "evidence_id": "evidence-after-1",
      "kind": "performance.sample",
      "summary": "Frame latency improved after the approved rollback."
    }
  ],
  "claims": [
    {
      "text": "<img src=x onerror=alert(1)> Rollback reduced the observed impact.",
      "fact_or_hypothesis": "FACT",
      "confidence": "HIGH",
      "evidence_ids": ["evidence-before-1", "evidence-after-1"]
    }
  ],
  "temporary_mitigation": {
    "action_id": "action-1",
    "tool": "recovery.set_feature_flag",
    "approval_id": "approval-1"
  },
  "permanent_recommendation": {
    "summary": "Fix the source binding and remove the per-row animation.",
    "source_fix_verified": false
  },
  "verification": [
    {
      "metric_name": "binding_errors_per_second",
      "before": 100.0,
      "after": 0.0,
      "unit": "errors/s",
      "evidence_ids": ["evidence-before-1", "evidence-after-1"]
    }
  ],
  "metadata": {
    "model_id": "gemini-test",
    "prompt_version": "1",
    "schema_version": "1.0",
    "policy_version": "1",
    "reuse_revision": "900ac97cf9b69b4a3c1f4899b08c9b1e78212af3"
  }
}
